{
  "contract_version": "1.0.0",
  "episode_date": "2026-08-06",
  "producer": "chatgpt",
  "story_plan": {
    "path": "story_plan_fixture.json",
    "sha256": "8db60b223232e88b5047fee1c49890e3a2a17d1f724d2e0bd160e7e9536f7daf"
  },
  "causal_dossier": {
    "path": "causal_dossier_fixture.json",
    "sha256": "44879ce0826d91c4b63e765fc5d9c9722df131cfc195b851a8b719911b8bc41e"
  },
  "scenes": [
    {
      "scene_id": "scene-01",
      "formal_role": "direction_and_conclusion",
      "narration": "おはようございます。昨夜のNasdaq Compositeは0.83%下落、SOXXは2.12%安でした。ところがNVIDIAは3.43%上昇し、AMDは7.04%下落。同じAI半導体なのに真逆です。僕はここを「AIが弱かった」で片づけず、数字は良かったのになぜ売られたのか、その採点表を追います。",
      "connection_to_previous": "opening",
      "evidence_ids": ["E-001"],
      "causal_claims": []
    },
    {
      "scene_id": "scene-02",
      "formal_role": "contradiction",
      "narration": "まずAMDです。Q2売上は115.4億ドル、データセンターは67.2億ドル。Q3見通しは約130億ドルでした。それでも株価は7.04%安。数字が弱くて売られた、という説明なら簡単ですが、今回はそこが噛み合いません。",
      "connection_to_previous": "but",
      "evidence_ids": ["E-004", "E-001"],
      "causal_claims": [
        {"claim_id": "claim-01", "statement": "AMDは通常予想を上回る見通しでも下落した。", "claim_type": "fact", "evidence_ids": ["E-004", "E-001"], "confidence": "high", "scope": "company"}
      ]
    },
    {
      "scene_id": "scene-03",
      "formal_role": "confirmed_facts",
      "narration": "解釈を足す前に順番を固定します。SpaceXの説明会は8月4日16時30分ET、AMDの説明会は17時ET。AMDはQ3見通し約130億ドルを示し、主要報道の通常予想約125.2億ドルを上回りました。ここまでは確認できる事実です。",
      "connection_to_previous": "therefore",
      "evidence_ids": ["E-003", "E-004", "E-006"],
      "causal_claims": []
    },
    {
      "scene_id": "scene-04",
      "formal_role": "expected_actual_gap",
      "narration": "では何がGapだったのか。通常の売上予想に対しては約4.8億ドル上振れです。一方、主要報道では大型顧客、利益率、AI投資回収の追加証拠まで期待されていたと伝えられています。つまり「数字が届いたか」と「AI競争の期待に届いたか」は別の採点欄だった可能性があります。",
      "connection_to_previous": "but",
      "evidence_ids": ["E-004", "E-005"],
      "causal_claims": [
        {"claim_id": "claim-02", "statement": "通常予想超過だけでは高まったAI競争期待を満たせなかったとの市場解釈がある。", "claim_type": "reported_interpretation", "evidence_ids": ["E-004", "E-005"], "confidence": "medium", "scope": "company"}
      ]
    },
    {
      "scene_id": "scene-05",
      "formal_role": "global_context",
      "narration": "その別の採点欄を具体化する材料が、同じ夜にNVIDIA側へ出ました。報道ではSpaceXがNVIDIA GPUだけを使うとの発言が伝えられました。NVIDIA側には「次の巨大需要を取った」という具体的な採用証拠が一つ増えた。一方、AMDには同じ種類の証拠がこの夜は見えていませんでした。",
      "connection_to_previous": "therefore",
      "evidence_ids": ["E-006", "E-007"],
      "causal_claims": [
        {"claim_id": "claim-03", "statement": "SpaceX採用報道はNVIDIA側に具体的な需要証拠を加えた。", "claim_type": "reported_interpretation", "evidence_ids": ["E-006", "E-007"], "confidence": "medium", "scope": "sector"}
      ]
    },
    {
      "scene_id": "scene-06",
      "formal_role": "market_reaction",
      "narration": "ここで値動きを重ねます。NVIDIAは3.43%高、AMDは7.04%安、SOXXは2.12%安。少なくとも「AI需要が全部弱い」では説明できません。採用証拠の差を評価した、という仮説は、この二極化とは整合します。ただし、これだけでNASDAQ全体の原因までAMDに背負わせるのは無理があります。",
      "connection_to_previous": "but",
      "evidence_ids": ["E-001", "E-007"],
      "causal_claims": [
        {"claim_id": "claim-04", "statement": "AMD/NVIDIAの二極化は採用証拠差を評価した仮説と整合する。", "claim_type": "grounded_inference", "evidence_ids": ["E-001", "E-007"], "confidence": "medium", "scope": "sector"}
      ]
    },
    {
      "scene_id": "scene-07",
      "formal_role": "entity_divergence",
      "narration": "NASDAQ側を見ると、Alphabetは4.03%安、Microsoftは1.09%安でした。一方でDowは上昇しています。だから昨夜は米国株全面安でも、AMD一社の夜でもありません。AMDは矛盾を見せる主役ですが、NASDAQの0.83%安には複数の大型テック材料が重なった、と分けて見る必要があります。",
      "connection_to_previous": "contrast",
      "evidence_ids": ["E-001", "E-008"],
      "causal_claims": [
        {"claim_id": "claim-05", "statement": "NASDAQ下落にはAMD以外の大型テック安も重なった。", "claim_type": "reported_interpretation", "evidence_ids": ["E-001", "E-008"], "confidence": "medium", "scope": "nasdaq_support"}
      ]
    },
    {
      "scene_id": "scene-08",
      "formal_role": "validation_points",
      "narration": "今後この仮説が強まるのは、AMDにSpaceX級の大型顧客が加わる、利益率や供給制約が改善する、そしてSOXXの上昇がNVIDIA以外にも広がる場面です。逆に、今回は金利・VIX・分足が不足していて、マクロや発言直後の寄与は確定できません。僕の整理では、昨夜はAI需要の有無より「次の巨大需要を取った証拠」が評価を分けた。ただしNASDAQ全体はそれ一つでは説明しない、ここまでが安全な結論です。",
      "connection_to_previous": "callback",
      "evidence_ids": ["E-009", "E-001", "E-004"],
      "causal_claims": [
        {"claim_id": "claim-06", "statement": "評価軸が次の巨大需要を取った証拠へ移った可能性がある。", "claim_type": "grounded_inference", "evidence_ids": ["E-004", "E-005", "E-007", "E-001"], "confidence": "medium", "scope": "sector"},
        {"claim_id": "claim-07", "statement": "金利・VIX・分足の寄与は確定できない。", "claim_type": "unknown", "evidence_ids": ["E-009"], "confidence": "unknown", "scope": "reason_unknown"}
      ]
    },
    {
      "scene_id": "scene-09",
      "formal_role": "fixed_closing",
      "narration": "以上、朝のNASDAQカフェでした。今日も気をつけて、いってらっしゃい。こちらはそろそろ、おやすみなさい。",
      "connection_to_previous": "closing",
      "evidence_ids": [],
      "causal_claims": []
    }
  ],
  "retained_counterevidence_ids": ["E-004", "E-001", "E-009"],
  "unresolved_points": [
    {"statement": "金利・VIX・QQQ・SMHの寄与は未確定。", "evidence_ids": ["E-009"]},
    {"statement": "個別発言直後の分足寄与は未確定。", "evidence_ids": ["E-009"]}
  ]
}
